{"acknowledgements":[{"afterValue":"eyJ0eXBlIjoiYm9vbGVhbiIsInZhbHVlIjp0cnVlfQ==","architecture":"arm64","beforeValue":"eyJ0eXBlIjoiYm9vbGVhbiIsInZhbHVlIjpmYWxzZX0=","componentRelativePath":"Contents/MacOS/Owned","keyUTF8":"ZXhwZWN0ZWQtY2hhbmdl","reportDigest":"446c2a5a75ffe3f8c9764646b950c01761af4f6a31a98b80b704a1395c4e0bfe","reviewDigest":"035f6536118a6f6f372e1d9923e99c74820d9983cf3a3746013ef827e25ac10c"}],"kind":"airs.review-policy","reviewModel":"airs.component.review.schema1.policy1","rules":[{"architecture":"arm64","check":"acknowledgedEntitlementChanges","componentRelativePath":"Contents/MacOS/Owned"},{"architecture":"x86_64","check":"requiredArchitectures","componentRelativePath":"Contents/MacOS/Owned"},{"check":"signatureValidity","componentRelativePath":"@app-root","scopeDescription":"whole app"}],"schemaVersion":1}